Title,ID,Year,Rating,Review
"To Kill A Mockingbird",tt0056592,1962,8,"Definitely has some oversimplification, but still a great movie."
"Lawrence of Arabia",tt0056172,1962,10,"A wonder of cinematic beauty and grandeur, this move—in parts—may seem to be little more than a power-corrupts film, but Peter O'Toole's unique and sensual performance makes it so much more."
"Cape Fear",tt0055824,1962,8,"Thrilling and suspenseful"
Goldfinger,tt0058150,1964,7,***
"Doctor Zhivago",tt0059113,1965,7,***
"The Good, the Bad and the Ugly",tt0060196,1966,9,"Though all of the Spaghetti Westerns are terrific, this one is possibly the best"
"Wait Until Dark",tt0062467,1967,7,"Or wait until that classic jump-scare; that's what the whole movie is leading up to"
Camelot,tt1672189,1967,7,***
"The Dirty Dozen",tt0061578,1967,9,"This is a perfectly emotional anti-hero film."
Rocky,tt0075148,1976,7,"One of, if not THE, best underdog story. The characters are real and the performances are heartfelt."
"Days of Heaven",tt0077405,1978,8,***
Hitch,tt0386588,2005,7,***
"Star Wars: Episode III - Revenge of the Sith",tt0121766,2005,8,"This is the highpoint of the prequels, delivering with emotion and motivation that the previous two lacked."
"Mr. & Mrs. Smith",tt0356910,2005,6,***
"King Kong",tt0360717,2005,8,***
"War of the Worlds",tt0407304,2005,7,"Created during Spielberg's plunge into darker filmmaking, War of the Worlds is good but most interesting as a case-study"
"Charlie and the Chocolate Factory",tt0367594,2005,4,"It will never compare to the Original. Never."
"Red Eye",tt0421239,2005,7,"I could do without the very end, but this movie is a top-notch thriller."
"Batman Begins",tt0372784,2005,8,"A revolutionary film as far as superheroes are concerned; the original gritty superhero movie. Nolan forever changed the industry by deciding to take the genre seriously."
"Fun with Dick and Jane",tt0369441,2005,6,***
"The Legend of Zorro",tt0386140,2005,4,***
"The Chronicles of Narnia: The Lion, the Witch and the Wardrobe",tt0363771,2005,7,***
"Fantastic Four",tt0120667,2005,6,***
"Pride & Prejudice",tt0414387,2005,8,***
"Zathura: A Space Adventure",tt0406375,2005,6,***
"The Shining",tt0081505,1980,8,"More disturbing than scary, The Shining is bolstered by atmospherism and powerful lead performances"
Gandhi,tt0083987,1982,9,"This is a moving, powerful epic about one of the most important figures in history—well worth every second of its 3h 11m runtime"
Scarface,tt0086250,1983,9,"More edgy than the Godfathers, it can easily stand on the same plane as a Gangster epic."
WarGames,tt0086567,1983,6,***
"Rocky IV",tt0089927,1985,7,"Everyone knows this is the best Rocky film. ""I will break you."" Classic."
"The Breakfast Club",tt0088847,1985,8,***
"Vision Quest",tt0090270,1985,2,"Vision Quest doesn't do a lot right, and it makes plenty of strange choices as a movie"
Labyrinth,tt0091369,1986,8,"A strange look into 80s filmmaking"
"The Name of the Rose",tt0091605,1986,6,***
Hoosiers,tt0091217,1986,7,***
Batman,tt0096895,1989,6,"This movie demonstrates how fascinating the Joker character can be"
"Dead Poets Society",tt0097165,1989,8,"An excellent and inspiring film, albeit cliche and heavy-handed at times"
Glory,tt0097441,1989,6,***
"National Lampoon's Christmas Vacation",tt0097958,1989,6,***
"Edward Scissorhands",tt0099487,1990,6,***
"Cape Fear",tt0101540,1991,8,"An excellent remake, just as thrilling and suspenseful as the previous"
"A Few Good Men",tt0104257,1992,7,"An engaging court film, though stereotypical at times."
"Batman Returns",tt0103776,1992,8,***
"My Cousin Vinny",tt0104952,1992,7,***
"Schindler's List",tt0108052,1993,10,"Possibly the greatest work by the greatest director makes Schindler's List possibly the greatest film of all time. Both heart wrenching and optimistic, this movie handles its delicate subject with complete care and aptitude. "
"The Firm",tt0106918,1993,6,***
"Sleepless in Seattle",tt0108160,1993,7,"More funny than romantic."
"Mrs. Doubtfire",tt0107614,1993,8,***
"The Shawshank Redemption",tt0111161,1994,9,"A simply beautiful and moving story"
Se7en,tt0114369,1995,9,"An intense movie with powerful performances, Se7en is another success for David Fincher. It is not necessarily thought-provoking, but is without a doubt a film that has more to offer than thrills."
GoldenEye,tt0113189,1995,8,"This is another example of my biased opinion, having grown up watching and loving this movie. But regardless, I see the campy yet thrilling Bond Series that I love at its finest."
Casino,tt0112641,1995,8,"Sam sets this movie apart from other gangster and Scorsese films by being a legitimately likable character."
"Batman Forever",tt0112462,1995,6,***
"Billy Madison",tt0112508,1995,6,"One of Sandler's early hits, this movie takes an easy-but-still-interesting premise and squeezes quality jokes from it"
"Romeo + Juliet",tt0117509,1996,8,"The beginning is wonderfully intense, and the source material certainly helps with the film's success."
"Happy Gilmore",tt0116483,1996,6,"Another of Sandler's early hits, this movie isn't special but it does deliver on occasional humor"
Titanic,tt0120338,1997,7,***
"Good Will Hunting",tt0119217,1997,9,"While I admire the filmmaking (and the music is particularly delightful given the year), this movie stands on the power of its humanity."
"Lock, Stock and Two Smoking Barrels",tt0120735,1998,7,***
"The Truman Show",tt0120382,1998,9,***
"American History X",tt0120586,1998,8,***
"Saving Private Ryan",tt0120815,1998,9,"In this, Spielberg demonstrates his aptidue for filmmaking, crafting narratives, and exploring deep themes."
"Fight Club",tt0137523,1999,8,***
"The Green Mile",tt0120689,1999,8,***
"The World Is Not Enough",tt0143145,1999,6,"This movie exists somewhere along the Brosnan-spectrum of Goldeneye (and its realism) and Die Another Day (and its campiness). In the middle is not a good place to be."
"Office Space",tt0151804,1999,9,"Exceptionally witty"
"Casino Royale",tt0381061,2006,8,***
"X-Men: The Last Stand",tt0376994,2006,6,***
"Superman Returns",tt0348150,2006,7,***
"Pirates of the Caribbean: Dead Man's Chest",tt0383574,2006,6,***
"Stranger Than Fiction",tt0420223,2006,7,"I remember hating it when I saw it (I felt mislead concerning the genre), but as I reflect on it, I appreciate its wit more and more."
"The Fast and the Furious: Tokyo Drift",tt0463985,2006,5,***
Cars,tt0317219,2006,7,***
"The Pursuit of Happyness",tt0454921,2006,7,***
"Deja Vu",tt0453467,2006,7,***
Click,tt0389860,2006,5,"Click has some inventive humor and an attempt at heart, but it ultimately suffers the same tonal issues as most Sandler flicks"
Dreamgirls,tt0443489,2006,7,***
"Nacho Libre",tt0457510,2006,8,***
"Martian Child",tt0415965,2007,1,"The reasons for my hatred of this movie are long, complex, and personal. But in short, it is a forced movie with little heart."
"Ocean's Thirteen",tt0496806,2007,8,***
"I Am Legend",tt0480249,2007,8,***
Disturbia,tt0486822,2007,7,***
"Spider-Man 3",tt0413300,2007,6,***
"Pirates of the Caribbean: At World's End",tt0449088,2007,6,***
Transformers,tt0418279,2007,7,***
"License to Wed",tt0762114,2007,5,***
Ratatouille,tt0382932,2007,9,"This is one of my personal favorite Pixar movies. It has many of the usual strengths of that studio, but it also manages to capture the experience of taste in a purely visual medium—something for which it receives full marks."
"Wild Hogs",tt0486946,2007,3,***
"Evan Almighty",tt0413099,2007,4,"Despite the wit of its lead actor, this movie fails to capture the humor of its predecessor"
"The Bourne Ultimatum",tt0440963,2007,8,***
"Fantastic 4: Rise of the Silver Surfer",tt0486576,2007,2,"This sequel offers little reason for existing beyond its mildly-more entertaining predecessor"
Snatch,tt0208092,2000,9,***
Memento,tt0209144,2000,9,"An excellent precursor to the career of one of the great modern directors"
Unbreakable,tt0217869,2000,9,"Though I may be biased as a lover of comicbooks, Unbreakable stands as one of Shyamalan's early feats."
"Ocean's Eleven",tt0240772,2001,10,"To the best of my knowledge, there is only one thing cooler than George Clooney, and that's Brad Pitt. So for a movie starring both of them—and with Matt Damon and Don Cheadle to boot—Ocean's Eleven easily stands as the coolest, wittiest, most stylish, most suspenseful heist film out there."
"Black Hawk Down",tt0265086,2001,4,"I couldn't keep up with the characters. I hear it is really good, though. I'll give it another chance soon enough."
"Spirited Away",tt0245429,2001,8,***
"A Beautiful Mind",tt0268978,2001,9,***
"The Italian Job",tt0317740,2003,7,***
"Big Fish",tt0319061,2003,8,"A beautiful, artsy movie. Relateable, in a way."
"Once Upon a Time in Mexico",tt0285823,2003,7,"The bold strokes of style are so much fun that you can't not enjoy this movie."
"The Matrix Reloaded",tt0234215,2003,7,***
"Matrix Revolutions",tt0242653,2003,6,***
Daredevil,tt0287978,2003,6,***
"Mean Girls",tt0377092,2004,7,***
"The Day After Tomorrow",tt0319262,2004,5,***
"Ocean's Twelve",tt0349903,2004,7,***
"Anchorman: The Legend of Ron Burgundy",tt0357413,2004,9,***
Troy,tt0332452,2004,8,"I'm a little biased, but I really like this movie. It's a terrific Epic based on a terrific epic. What it wants to do—which is entertain me—it does really well."
"Million Dollar Baby",tt0405159,2004,6,***
"The Punisher",tt0330793,2004,7,"It's depressing and violent, and it lacks a thematic/artistic taste to lift it above its flaws. Still, the characters seem interesting enough and there is a glimmer of creativity in the ""by-the-numbers revenge."""
"Dodgeball: A True Underdog Story",tt0364725,2004,7,***
"A Series of Unfortunate Events",tt0339291,2004,6,***
"Napoleon Dynamite",tt0374900,2004,9,"Napolean Dynamite was a truly inventive film that revolutionized the comedy-drama for the next decade, and in some ways, ushered in the current age of independent movie-making."
"Indiana Jones and the Kingdom of the Crystal Skull",tt0367882,2008,7,"Harrison Ford is great and the movie is a lot of fun."
"Iron Man",tt0371746,2008,9,"Iron Man is significantly more tame than the most recent franchise installments, and by its smaller scope, it delivers one of the most personal stories in the universe. The movie is also noteworthy purely for its cinematic influence, not only for establishing the summer tentpole genre for the next decade but also for demonstrating the power of casting."
"The Dark Knight",tt0468569,2008,9,"Presently my favorite superhero movie. With snazzy moral dilemmas and a wonderful performance by Ledger, you can easily get over Maggie Gyllenhaal."
Hancock,tt0448157,2008,6,***
"Quantum of Solace",tt0830515,2008,6,***
"The Incredible Hulk",tt0800080,2008,7,"It’s better than you remember."
Cloverfield,tt1060277,2008,8,***
Twilight,tt1099212,2008,7,"This subpar movie excels only in cultural importance and in its soundtrack"
"The Curious Case of Benjamin Button",tt0421715,2008,8,"The most intriguing part is how they handle everyone's greatest fear: to grow weak, ugly, and old—they take the infamously handsome Brad Pitt and watch as he becomes stronger, younger, and more beautiful."
Taken,tt0936501,2008,6,***
300,tt0416449,2006,8,"This movie is exciting and visually thrilling, and has narrative strength as well. I don't think this is the greatest movie of the year, but it is certainly more than pulp film."
"The Devil Wears Prada",tt0458352,2006,7,***
"The Illusionist",tt0443543,2006,8,***
"The Prestige",tt0482571,2006,9,"Suspenseful and beautifully shot, The Prestige acts as a great showcase for the abilities of its two leads."
"The Assassination of Jesse James by the Coward Robert Ford",tt0443680,2007,8,***
"National Treasure: Book of Secrets",tt0465234,2007,4,***
"American Gangster",tt0765429,2007,8,***
"Slumdog Millionaire",tt1010048,2008,8,***
WALL-E,tt0910970,2008,8,"Wall-E captures the charm and the skill of the early comedy greats like Keaton and Chaplin in a futuristic, topical premise"
"Seven Pounds",tt0814314,2008,5,***
"Kung Fu Panda",tt0441773,2008,8,***
"Much Ado About Nothing",tt0107616,1993,8,***
Zombieland,tt1156398,2009,8,***
"Sherlock Holmes",tt0988045,2009,8,"As no loyalist to the books, Sherlock Holmes is a serviceable mystery with plenty of Ritchie's flair"
"Star Trek",tt0796366,2009,8,"Super cool and lots of fun."
"Transformers: Revenge of the Fallen",tt1055369,2009,5,***
"The Princess and the Frog",tt0780521,2009,7,"The thematic exploration is one of Disney’s best, as is the style and villain of the film, but in the end, the movie is too contrived and not patient with its own development."
"The Invention of Lying",tt1058017,2009,3,"The first rule of being a comedy is being funny. This movie tries too hard to push its message (one I obviously dislike) and too little on being funny"
"He's Just Not That Into You",tt1001508,2009,6,***
"District 9",tt1136608,2009,7,***
"500 Days of Summer",tt1022603,2009,8,"There is a lot wrong with this movie, but also a lot that Webb and the writers got right. One of the best romance movies ever and very possibly the best romantic comedy."
"17 Again",tt0974661,2009,5,***
"X-Men Origins: Wolverine",tt0458525,2009,3,***
Knowing,tt0448011,2009,5,"A strangely dark and creative tale that ultimately gives no satisfaction to the viewer"
"Terminator Salvation",tt0438488,2009,5,***
"The Proposal",tt1041829,2009,5,***
"Paul Blart: Mall Cop",tt1114740,2009,5,***
"The Twilight Saga: New Moon",tt1259571,2009,5,***
"The Lovely Bones",tt0380510,2009,7,***
Avatar,tt0499549,2009,7,"It's a great movie and there might even be nothing wrong with it. But there's also nothing special."
"Dr. Jekyll and Mr. Hyde",tt0022835,1931,9,"Dr. Jekyll is one of my earliest excursions into pre-Cold War cinema, and its emotional, dramatic performances have stayed with me all this time"
"Inherit the Wind",tt0053946,1960,10,"Through bias, neither side in this movie comes off as perfect. I love this film because we see the timeless battle between Liberal and Conservative. The men and women in this film experience pride and experience joy, a longing to hurt others and a longing to keep those around them safe, a desire to progress and a desire to hold to what they know is right despite the changing pressures. The performances are heartfelt; I can't help but tear up."
"Dr. Strangelove or: How I Learned to Stop Worrying and Love the Bomb",tt0057012,1964,7,***
Shenandoah,tt0059711,1965,7,"It is the family dynamics of this film that pull it above a mediocre Western. Stewart does an excellent job as usual."
"Who's Afraid of Virginia Woolf?",tt0061184,1966,10,"The first time I saw Who's Afraid of Virginia Woolf, I remember thinking to myself, ""What is this?"" But not like that—not in a questioning or dismissive way. I asked because I could not understand how I felt so close to the characters. I had never experienced that sensation—at least not outside of my books, not in the form of real people saying their lines on a screen in front of me. Now, many years removed from that first viewing, I am inclined to write-off my reaction to my unfamiliarity with cinema's canon. But I believe I would be wrong to do that. Surely, it is due, in part, to the original playwright, Edward Albee, but I think this movie captures its audience with the reality of it all. The characters seem real, and the dialogue does too. The events and the stories are all too familiar. The tragedy of life is laid out before us, and we cannot help but weep for it."
"The Graduate",tt0061722,1967,8,"The existentialist nature of the movie is a little off-putting, but the mood of the movie is uncannily effective."
"2001: A Space Odyssey",tt0062622,1968,10,"This film is, I believe, Kubrick's magnum opus; it is—in the truest sense of the word—a masterpiece that bends the audience's emotion like a conductor directing an orchestra."
"The Godfather",tt0068646,1972,10,"All of the artistic elements of filmmaking come together here and make an unmistakable masterpiece. It is an epic centered on a family, and the love and the cruelty therein."
"Taxi Driver",tt0075314,1976,8,"Taxi Driver is a horrifying look at the underbelly of 70s America and the damages of poor mental healthcare "
"Apocalypse Now",tt0078788,1979,7,***
"The Warriors",tt0080120,1979,7,***
"Raging Bull",tt0081398,1980,10,"Raging Bull is the greatest achievement of Frank Vincent, Joe Pesci, Robert De Niro, and Martin Scorsese, some of the greatest contributors to the film world. It is also, easily, one of the greatest movies ever. Raging Bull tells a story that defies genre, and does it in a most sobering way. De Niro's LaMotta can do nothing but evoke emotion from its audience, and for that, it may suffer among viewers. At times it may be too artsy, and at times it may be too gritty, but it is all for the greater effect. It is a masterpiece of cinema, that leaves you—the viewer—sympathizes for its victims. Never empathizing, though; how could you? There is little more to love in Jake ""the Bull"" LaMotta."
"Saludos Amigos",tt0036326,1942,5,"There’s little to endear it to a viewer."
"The Three Caballeros",tt0038166,1944,5,"This should not be an animated classic."
"Melody Time",tt0040580,1948,6,"It’s a little less cute and a little less fun than Make Mine Music."
"The Hairy Ape",tt0036892,1944,5,***
"The Black Cauldron",tt0088814,1985,8,"This forgotten gem glimmers on rare occasion with excellent artwork and darker themes. Check out Ebert’s review on this flick."
"Big Trouble in Little China",tt0090728,1986,8,"This movie is hilariously silly"
GoodFellas,tt0099685,1990,9,***
"Troll 2",tt0105643,1990,8,"Ratings break down for movies like this. But if we're giving it a score for how much I enjoy watching it with friends, then something high seems right."
"Rosencrantz & Guildenstern Are Dead",tt0100519,1990,7,***
"The Silence of the Lambs",tt0102926,1991,8,"Two villains, both sharing the spotlight, makes for a thrilling movie that leaves you on the edge."
"Pirates of Silicon Valley",tt0168122,1999,7,***
Ali,tt0248667,2001,7,"The boxing sequences are terrific and the storyline is nothing but interesting, but still, I was never quite captured by the movie."
"Love Actually",tt0314331,2003,6,"The movie is able to create a relationship and produce empathy for each of its characters despite the division of screen time among them—an impressive feat. Nonetheless, the movie falls into classic rom-com deficiencies and is appallingly materialistic/sexual."
"The Notebook",tt0332280,2004,6,"While the story of anyone with Alzheimer's is tragic, the movie is otherwise wheel-spinning"
"V for Vendetta",tt0434409,2005,8,"It's a college favorite"
"Prince of Persia: The Sands of Time",tt0473075,2010,6,***
Apocalypto,tt0472043,2006,7,"Super entertaining story with a character you easily sympathize with"
"Sense and Sensibility",tt0114388,1995,8,***
"The Twilight Saga: Eclipse",tt1325004,2010,5,***
"Robin Hood",tt0955308,2010,3,"There are mere minutes of entertaining action inside this mess"
Megamind,tt1001526,2010,8,"I'm a little tied on this vs. Shrek, but regardless, it is one of the funniest animated movies there is."
"Iron Man 2",tt1228705,2010,7,"This sequel captures little of its predecessor’s magic but does include a couple notable performances."
"True Grit",tt1403865,2010,6,"It advertised as a dark Western. It was not that at all. That's points off; why not just advertise it as the strong yet lighthearted Western that it is."
Tangled,tt0398286,2010,8,"Tangled has a lot of tangible goodness, including one notably creative scene, yet some of the gags and characters feel a little stock."
Inception,tt1375666,2010,8,"A great heist film with practical effects"
"How to Train Your Dragon",tt0892769,2010,7,"It's a good movie, but it's hard for me to fathom the huge following behind these movies"
Superbad,tt0829482,2007,6,"A somewhat revolutionary film for the comedy genre, launching a few careers. Pretty funny, but I think seeing it so late ruined it for me since it could not possibly live up to the hype it received."
"The Social Network",tt1285016,2010,8,***
"Toy Story 3",tt0435761,2010,8,***
"The Hangover",tt1119646,2009,8,"Clever and crass, The Hangover is one the funniest movies I have ever seen."
"127 Hours",tt1542344,2010,8,***
"Get Him to the Greek",tt1226229,2010,3,***
"Black Swan",tt0947798,2010,7,***
"City of God",tt0317248,2002,10,"Cidade de Deus, on merit of story alone, struggles to stand with giants like Goodfellas and Gangs of New York. But simply because of the color and sound—the culture and love—emanating from the film, City of God can compete. For me, what is most stirring is merely seeing the cover/poster for the movie and remembering Rocket's boyish love and remembering what he lost."
"Harry Potter and the Sorcerer's Stone",tt0241527,2001,7,***
"Harry Potter and the Chamber of Secrets",tt0295297,2002,7,***
"Harry Potter and the Prisoner of Azkaban",tt0304141,2004,8,"The characters introduced here and the directorial choices are a welcome change that lift this episode above the rest."
"Harry Potter and the Goblet of Fire",tt0330373,2005,7,***
"Harry Potter and the Order of the Phoenix",tt0373889,2007,7,"Though I rated it the same as most of the others, the final dual is magnificent and undoubtedly one of the best scenes of the series."
"Harry Potter and the Half-Blood Prince",tt0417741,2009,7,"The character and actor for Dumbledore are at their best here."
"Harry Potter and the Deathly Hallows: Part 1",tt0926084,2010,7,***
"The Apple Dumpling Gang",tt0072653,1975,6,***
"The Dilemma",tt1578275,2011,5,"This movie deals with oddly deep issues but lacks the narrative focus to come to any conclusion"
Anonymous,tt1521197,2011,4,***
"The Lincoln Lawyer",tt1189340,2011,7,***
"Pirates of the Caribbean: On Stranger Tides",tt1298650,2011,4,"This movie represents the transition of a franchise from above-average and creative to bloated and cynical"
Limitless,tt1219289,2011,8,"Limitless rightfully earns its place as a cult classic for its charismatic though flawed delivery"
Invictus,tt1057500,2009,6,***
"Transformers: Dark of the Moon",tt1399103,2011,5,***
"Harry Potter and the Deathly Hallows: Part 2",tt1201607,2011,8,***
"X-Men: First Class",tt1270798,2011,6,"I love Magneto and Kevin Bacon—the rest I can do without."
"Inside Man",tt0454848,2006,7,***
Immortals,tt1253864,2011,4,"This movie tries shamefully to copy 300 and with little success"
"American Psycho",tt0144084,2000,8,"One of the most haunting movies I have seen"
"The Departed",tt0407887,2006,9,"A modern addition to the classic gangster epics: Godfather, Scarface, Goodfellas, etc."
Zodiac,tt0443706,2007,8,***
"The Tree of Life",tt0478304,2011,8,"The message it delivers, I've heard before. And the beginning is so slow. But everything is made brand-new. From the cosmic to micro—through a family that conjures up my own memories—I am forced to acknowledge those mighty words God spoke to Job. Honestly, I was excited for the acting, the effects, the vistas, the 2001-like meditative pace, but it was the theme that took me."
"Sky Captain and the World of Tomorrow",tt0346156,2004,5,***
"The Butterfly Effect",tt0289879,2004,7,***
"The Holiday",tt0457939,2006,6,"While there were parts that I definitely liked, the movie seemed confused through most of its two hour run-time."
"The Big Lebowski",tt0118715,1998,9,***
"Austin Powers: International Man of Mystery",tt0118655,1997,7,"This franchise provides three funny, if not uneven, parodies"
"Austin Powers: The Spy Who Shagged Me",tt0145660,1999,7,"This franchise provides three funny, if not uneven, parodies"
"Austin Powers In Goldmember",tt0295178,2002,6,"This franchise provides three funny, if not uneven, parodies"
"The Descendants",tt1033575,2011,7,***
"The Royal Tenenbaums",tt0265666,2001,8,***
Watchmen,tt0409459,2009,8,"An adaptation of a great graphic novel, commenting on the last few decades, with an enthralling style."
"The Godfather: Part II",tt0071562,1974,10,"All of the artistic elements of filmmaking come together here and make an unmistakable masterpiece. It is an epic centered on a family, and the love and the cruelty therein."
"The Godfather: Part III",tt0099674,1990,8,"I'm tempted to rate this lower. I am torn on whether its association with the other two Godfather's helps or hurts it; I feel connected to Part III since I have gotten to know all the characters so well, but when compared to the other two, this movie definitely falls short. On its own, I think it deserves more than what it gets."
"Fast Five",tt1596343,2011,7,***
"Source Code",tt0945513,2011,8,***
Thor,tt0800369,2011,6,"Thor, like most of the movies in the Marvel’s first phase, comes loaded with humor and heart but lacks some of the special features of its peers."
"One Flew Over the Cuckoo's Nest",tt0073486,1975,9,Tragic
"Reservoir Dogs",tt0105236,1992,7,"A gritty Twelve Angry Men of sorts."
"Captain America: The First Avenger",tt0458339,2011,7,"Like Avengers: Age of Ultron, the first Captain movie is a divider, entering us into the greatest of the MCU, the ones that each accomplish something special. And Captain America: The First Avenger is special for delivering a romanticized hero, something audiences hadn’t seen since The Rocketeer or 1978’s Superman."
"Pulp Fiction",tt0110912,1994,8,"Pulp Fiction is a cultural touchstone and revolutionary film. It excels in narrative structure, lyrical writing, and the capturing of a milieu "
"Fantastic Mr. Fox",tt0432283,2009,7,***
"Sherlock Holmes: A Game of Shadows",tt1515091,2011,6,***
Drive,tt0780504,2011,7,***
"Crazy, Stupid, Love.",tt1570728,2011,8,"A great romance, it has wonderful things to say about love and marriage. It's funny, but it's obvious that humor is not its main goal. This film is a great addition to the few believable rom-coms out there that say good things about traditional institutions."
