Title,ID,Year,Rating,Review
"Super Troopers",tt0247745,2001,5,"Dumb but funny"
"The Lorax",tt1482459,2012,6,***
"Rain Man",tt0095953,1988,7,"Excellent and heartfelt performances with some snazzy tricks from the autistic savant, but my interest peaked out and I never was ""amazed."""
"Moonrise Kingdom",tt1748122,2012,7,"I have very mixed feelings about this movie, but at the end of it all, I can easily say it's a good movie."
Savages,tt1615065,2012,6,***
Prometheus,tt1446714,2012,5,"Entertaining but filled to the brim with plot holes."
[Rec],tt1038988,2007,7,"I'm not a scary movie buff, but for me, it doesn't get much scarier than this."
"The Avengers",tt0848228,2012,10,"Some have said The Avengers doesn’t hold up well. I say: Nonsense. The wit is perfect, the story streamlined. Each character is given their motivation and their story understands that motivation; all threads come together and everything is paid off. In addition to these fundamental virtues, though, The Avengers is a huge movie with huge importance. More than Iron Man, The Avengers showed what the MCU could be and continues to be. It is, in many regards, a perfect movie."
"No Country for Old Men",tt0477348,2007,10,"Though it makes me laugh on occasion, it is sadly nostalgic."
"There Will Be Blood",tt0469494,2007,9,"This is possibly Paul Thomas Anderson's strongest film with a fine performance by Daniel Day-Lewis. It stands alongside All About Eve and Citizen Kane as one of the great power corrupts stories."
"The Bourne Legacy",tt1194173,2012,5,"Action movie. It was thrilling at some points, but for the most part, just an action movie going through the formula."
"American Beauty",tt0169547,1999,10,"I greatly appreciate movies that can balance multiple genres at once, like this comedy meets tragic-drama. Its sad commentary on middle class life and complacency is piercing."
"The Cabin in the Woods",tt1259521,2012,8,"I hate horror movies, yet I loved this movie. Now, I admit, everything I dislike about horror movies, I disliked in this movie, but The Cabin in the Woods had so much more to offer. Funny and Scary? They said it couldn't be done, but apparently, they were wrong."
"The Amazing Spider-Man",tt0948470,2012,6,"Though correcting some of the previous franchise's errs, it lacks the emotional intelligence and film craftsmanship"
"The Maltese Falcon",tt0033870,1941,8,"The Maltese Falcon is a pinnacle noir film, more focused on the intrigue of the characters than that of its MacGuffin. "
"The Way of the Gun",tt0202677,2000,5,"There were some really fun parts in this movie, but the end slowed down rather than speeding up and the family dynamics remind me of the Bold and the Beautiful."
"The Beaver",tt1321860,2011,7,***
"The Hobbit: An Unexpected Journey",tt0903624,2012,7,"A really fun movie, but not much like Jackson's other films. And seriously, the FPS is like watching a soap opera."
"Mrs. Miniver",tt0035093,1942,5,***
"Les Miserables",tt1707386,2012,6,"Good—great source material obviously—but the camera man should take a few steps back."
Lincoln,tt0443272,2012,8,"The ""Inspirational"" film seems contrived and gimmicky but is nonetheless wonderful. The screenwriting and Day-Lewis's performance are particularly good."
"The Dark Knight Rises",tt1345836,2012,7,"Though correcting some directing issues from the previous two, this film still feels less cohesive"
Skyfall,tt1074638,2012,8,"It borrows a lot from the Bourne, Batman, and Die Hard series, but in so doing, it creates its own masterpiece. The balance (and resurrection) of the campier Bond films is a pleasant addition to the Craig era."
Unforgiven,tt0105695,1992,9,"Maybe I am too generous with this movie, but Unforgiven is one of the reasons I love the Western genre. Both a commentary on the genre and violence, this is a masterpiece film with funny, sad, and thrilling moments all."
"A Clockwork Orange",tt0066921,1971,7,"The soundtrack and sound-effects are some of the best, and the themes tossed around will not soon leave your mind. But, I would never advise someone to watch this movie—it is vulgar and grotesque. Also, though I do not think it ultimately achieves this, it comes dangerously close to celebrating wickedness through irresponsible directing"
"A Personal Journey with Martin Scorsese Through American Movies",tt0112120,1995,7,"A very atypical look at the history of cinema. It could definitely be boring at times with a near 4 hour length, but I learned a lot."
"Legally Blonde",tt0250494,2001,6,***
"Dog Day Afternoon",tt0072890,1975,6,***
"Sunset Boulevard",tt0043014,1950,9,***
"Moulin Rouge!",tt0203009,2001,9,"A wonderfully original musical"
"The Artist",tt1655442,2011,8,***
"Notting Hill",tt0125439,1999,6,***
"Salmon Fishing in the Yemen",tt1441952,2011,6,***
"Touch of Evil",tt0052311,1958,8,"It's possibly more beautiful than it is thrilling"
"The Hudsucker Proxy",tt0110074,1994,6,***
"The Passion of Joan of Arc",tt0019254,1928,7,"As a modern viewer, it's hard to get past some of the techniques and methods used in this movie. But regardless—largely thanks to the score—it is a powerful story that makes you care."
"Visions of Light",tt0105764,1993,8,"Visions of Light is an intriguing look at the art of cinematography"
"The Quiet Man",tt0045061,1952,7,"A solid, if not mild, film"
"The Lives of Others",tt0405094,2006,7,"A very interesting movie that draws in your sympathy."
"Cinema Paradiso",tt0095765,1988,7,"A pretty good movie, with a wonderful ending."
"Il Postino",tt0110877,1994,7,"Il Postino is a fine movie, coasting mostly on its warmth of setting"
"The Third Man",tt0041959,1949,8,***
"Singin' in the Rain",tt0045152,1952,9,"This movie truly is a classic in every sense. It has a little depth parallel to the story, but mainly it's just fun—clever, funny, aesthetically rich, and entertaining."
"The Sting",tt0070735,1973,8,"Stylish, funny, and thrilling, The Sting is the <i>true</i> inspiration for one of my personal favorites, Ocean's Eleven."
"The Tingler",tt0053363,1959,6,"It's a fun horror flick, but I expected a few more laughs or a few more scares than I got."
"The Outlaw Josey Wales",tt0075029,1976,9,"This is an important part of why I like Westerns: their ""revisionist"" history."
"The Wind Rises",tt2013293,2013,7,***
"Anchorman 2: The Legend Continues",tt1229340,2013,7,***
"Annie Hall",tt0075686,1977,8,***
"Beasts of the Southern Wild",tt2125435,2012,5,***
"Dallas Buyers Club",tt0790636,2013,7,"Artsy, well-acted, and deep (having 3 major themes with roughly the same amount of screen-time), Dallas Buyers Club has all the aspects of a good movie. It is not quite as entertaining as other movies with similar themes (e.g. Wolf of Wall Street), and it seemed to run through the motions at times, not adding anything new."
"Children of Men",tt0206634,2006,6,***
Lawless,tt1212450,2012,6,***
"Pitch Perfect",tt1981677,2012,6,"Though filled to the brim with cliches, the songs are catchy and fun"
"Silver Linings Playbook",tt1045658,2012,6,***
"When Harry Met Sally...",tt0098635,1989,8,***
"The Perks of Being a Wallflower",tt1659337,2012,7,***
"Iron Man 3",tt1300854,2013,7,"Paralleled by only a few other movies on this list, Iron Man 3 demonstrates what it means to understand your own characters. While it took some time to get over my fanboy rage regarding the Mandarin, I came around to appreciated Shane Black’s handling of Tony Stark and tangental structuring of the narrative."
Hugo,tt0970179,2011,8,***
"The Room",tt0368226,2003,8,Spoon!
42,tt0453562,2013,7,***
"Thank You For Smoking",tt0427944,2005,9,"The ending could have been better, but as far as comedies go, this is definitely one of the best."
Redline,tt0780595,2009,8,***
8½,tt0056801,1963,8,"A sort of cinematic ""Portrait of the Artist as a Young Man,"" I started off disliking it—much like I did that book. But then after enough exposure, I had entered Guido's mind and Fellini's mind. And I understood it and empathized with it."
"The Great Gatsby",tt1343092,2013,6,"Though the novel isn't my favorite, this movie—while fine—fails to capture its source material's virtue"
"The Last Emperor",tt0093389,1987,7,"Creative in its use of color, The Last Emperor explores a trying time through the eyes of an important figure"
"Inglourious Basterds",tt0361748,2009,8,***
"Django Unchained",tt1853728,2012,9,"The Soundtrack is this movies greatest asset."
Chinatown,tt0071315,1974,9,"An elegant reentry to Noir. The Title is what makes this movie."
"Wreck-it Ralph",tt1772341,2012,6,"The premise is funny and some of the jokes are witty, but Wreck-It-Ralph lacks anything extraordinary."
"Man of Steel",tt0770828,2013,7,"The movie has definite short-comings (lack of change, dismissal conclusion, excessive violence) but is still a passable superhero film."
"Despicable Me 2",tt1690953,2013,5,***
"Meet the Parents",tt0212338,2000,7,***
"Jerry Maguire",tt0116695,1996,8,"Funny, entertaining, and fairly realistic love-story"
"L.A. Confidential",tt0119488,1997,8,***
"Full Metal Jacket",tt0093058,1987,8,***
"Eternal Sunshine of the Spotless Mind",tt0338013,2004,8,***
"Road to Perdition",tt0257044,2002,7,***
"The Master",tt1560747,2012,7,"I think Ebert describes this movie best when he says it has beauty and it has power, but when you grasp for it, you just grab air."
"The Wolverine",tt1430132,2013,7,***
"City Lights",tt0021749,1931,7,"A sweet and light-hearted early film"
"Fast & Furious 6",tt1905041,2013,8,***
Argo,tt1024648,2012,7,***
"Like Crazy",tt1758692,2011,8,***
Rounders,tt0128442,1998,7,***
50/50,tt1306980,2011,7,"You know who the best part of this movie is? Serge Houde. Hands down. 50/50 may not have the most profound message on the topic, but it handles it well and is very funny."
"World War Z",tt0816711,2013,8,"Plenty of tropes, without a doubt, but gripping and intense."
"Captain Phillips",tt1535109,2013,7,"Hanks does a great job of course, but the ""villains"" are a pleasant surprise."
Testament,tt0086429,1983,5,***
"Synecdoche, New York",tt0383028,2008,8,***
"Meet the Robinsons",tt0396555,2007,8,"This movie moves too quickly but manages funny, engaging characters nonetheless."
Bolt,tt0397892,2008,7,"It can be funny, but for the most part, the movie feels pretty generic."
Gravity,tt1454468,2013,8,"This movie reminds me of 2001, but not just because it's about Space. The movie, as has been pointed out already, is great not for its plot but for its visuals—because Cuaron knows where to place a camera. It reminds me of 2001, because it purposefully and masterfully directs my mind and my gut. Gravity is in complete control of how I feel, thrilling me the whole time."
Fargo,tt0116282,1996,10,"This is certainly my favorite from the extraordinarily talented Coen brothers. The seamless parallel of humor, commentary, and dark thrills is unequaled."
"Guess Who's Coming to Dinner",tt0061735,1967,8,***
"Cool Hand Luke",tt0061512,1967,9,***
Shane,tt0046303,1953,9,"I do love a good Western, and this is one of the best."
"The Fountain",tt0414993,2006,7,"I think there are two problems that you can pin on this movie: not enough time is spent developing empathy for the characters, and the movie tries too hard—too much symbolism, motifs, connections, etc. I think Jackman's acting definitely starts to make up for the first, and the second isn't inherently bad. The Fountain tries to be artsy and ambiguous, but still stricken with hubris, tries to answer a big question. But that is all right, because I think it gives a good answer."
"Rise of the Planet of the Apes",tt1318514,2011,7,"The character of Caesar (as given to us by Andy Serkis) is magnificent and regal, setting this re-launch apart from the rest of franchise."
"Monsters University",tt1453405,2013,7,***
"The Hobbit: The Desolation Of Smaug",tt1170358,2013,6,***
Hellboy,tt0167190,2004,6,***
"The Wolf of Wall Street",tt0993846,2013,8,"I remember thinking during this movie, ""Is Scorsese pulling a Seinfeld here? Surely not..."" By the end of the film, I had settled on being appalled at the movie's decadence. But since then, someone has confirmed my earlier suspicions—Martin surely was pulling a Seinfeld: the movie is wicked and funny, and it is precisely our acceptance of that vulgarity that makes it wrong."
Dekalog,tt0092337,1989,10,"Greater than any of its technical achievements is its thematic word. The Decalogue reimagines what it means to live out God's revelation to humankind on Sinai, making it frighteningly closer to our hearts."
"Treasure Planet",tt0133240,2002,7,"The animation is pretty and the villain surprisingly complex, but the CGI has badly dated the movie."
"The Aristocats",tt0065421,1970,6,"Though notable for its influence on Pulp Fiction, this movie isn’t great. It has some fun parts, but you never really care about its characters."
"Chicken Little",tt0371606,2005,5,"The movie has heart and some solid jokes, but it tries too hard and the animation is lacking."
"Brother Bear",tt0328880,2003,5,"The movie suffers from an abundance of cliches; moreover, it montage-d its most important scene."
"Home on the Range",tt0299172,2004,5,"It has some surprisingly good cinematography and music, but the story is cliche and the main character uninteresting."
Frozen,tt2294629,2013,9,"Though its beginning is too rushed for effectiveness, Frozen is a beautiful, epic fairytale with excellent music and sweet storytelling."
"Saving Mr. Banks",tt2140373,2013,7,***
"Raising Arizona",tt0093822,1987,7,***
"Hot Rod",tt0787475,2007,6,***
"Do the Right Thing",tt0097216,1989,9,"A masterpiece of topical filmmaking: <a class='link' href='https://birthmoviesdeath.com/2014/08/18/hulks-favorite-movies-do-the-right-thing-1989'>Film Crit Hulk's Review</a>"
Her,tt1798709,2013,8,***
Non-Stop,tt2024469,2014,7,***
Cube,tt0123755,1997,6,"Neat ideas and visually elegant, but poorly executed."
"My Dinner with Andre",tt0082783,1981,8,"The movie is boring and long, and though I hate the sort of people in it, My Dinner with Andre has worthwhile depth"
Noah,tt1959490,2014,8,"Since it took an obviously ludicrous approach to its depiction of Scripture, this biblical epic has received a lot of flack. But the movie is undoubtedly entertaining and boasts the intimacy and psychological-depth that Aronofsky is known for."
Alien,tt0078748,1979,8,"Obviously the symbolism is dense, and that makes for an interesting movie. But I found the best part of the movie to be the acting and special effects—both aspects that made the movie ""beautiful"" in its own way."
Carrie,tt0074285,1976,8,***
"X-Men: Days of Future Past",tt1877832,2014,9,"This movie took everything good from the X-Men franchise and put in one place. I've come to very much appreciate Michael Fassbender, and the Quicksilver scene was remarkable."
"That Thing You Do!",tt0117887,1996,7,***
"Sleepy Hollow",tt0162661,1999,5,***
"Big Hero 6",tt2245084,2014,7,"Though it is beautifully animated with an exciting second half, its pacing is too quick and it feels like it's just hitting the beats."
"Transformers: Age of Extinction",tt2109248,2014,4,"There were more cliches than normal in this one, and it didn't even do a good job with the one element that I have consistently liked in the other movies: empathy and awe for Optimus Prime."
Admission,tt1814621,2013,4,***
"How to Train Your Dragon 2",tt1646971,2014,7,***
"Warm Bodies",tt1588173,2013,8,"A beautiful blend of three different genres, Warm Bodies is one of the best movies I have seen in a while. It acted as a powerful metaphor, but as to what, I still have a couple choices in my head to choose from."
Metropolis,tt0017136,1927,8,"This movie took me a long time to get through, largely because of (despite its beauty) how slow the beginning 45 minutes were. But when it got going, it kept me enticed nearly as much as any modern-era flick. And regardless, the score, arrangement, and grandeur make Metropolis truly the most ""magnificent"" film I've ever seen."
"True Grit",tt0065126,1969,7,***
"Heaven is for Real",tt1929263,2014,4,"There are a lot of shortcomings in this movie, but there's so much more that could have gone wrong that the makers tactfully avoided."
"Before Sunrise",tt0112471,1995,8,"This movie is a more entertaining version of My Dinner with Andre. It is innovative, wise, and perhaps noble."
"Before Sunset",tt0381681,2004,9,"Better, I think. Sunrise has novelty, freshness, format all to its benefit. And Sunset has those same elements too, but it has something more. The romance matters more here. The story is more about these two than about their heady ideas. There is something uncannily magnetic about this film and its older sister, something that makes them special and not quickly forgettable."
"Guardians of the Galaxy",tt2015381,2014,9,"This film took the irreverent hilarity of The Avengers and amplified it a hundredfold, maintaining still its action-packed suspense and occasionally moving scenes."
"Good Morning, Vietnam",tt0093105,1987,8,"This is coming just days after the death of Williams, but even with such nostalgia aside, this movie's greatness is completely wrapped up in the performance of the late comedian. There a couple of compelling scenes in the movie and there is no lack of heart, but this film was certainly written to brandish the skills of Robin Williams."
"The Blob",tt0051418,1958,6,***
"About Time",tt2194499,2013,8,***
"Wayne's World",tt0105793,1992,8,"Wayne's World is both silly and brilliant"
"Red Dawn",tt0087985,1984,6,***
"Mad Max",tt0079501,1979,10,"By the artful direction of George Miller, these films each stand as thriller-masterpieces with practical stunts and action to immerse their viewers."
"Captain America: The Winter Soldier",tt1843866,2014,8,"Like Ant-Man, The Winter Soldier explored a new genre for the Marvel franchise. As an action-oriented spy-thriller, this movie works as a fast-paced genre-blending blockbuster. Its choreographed fight scenes stand out as some of the best in the business."
"The Road Warrior",tt0082694,1981,9,"By the artful direction of George Miller, these films each stand as thriller-masterpieces with practical stunts and action to immerse their viewers. Mad Max 2 demonstrates the perfect balance of visceral, gritty action and Miller's apocalyptic vision."
"Mad Max Beyond Thunderdome",tt0089530,1985,7,"By the artful direction of George Miller, these films each stand as thriller-masterpieces with practical stunts and action to immerse their viewers."
"The Usual Suspects",tt0114814,1995,8,***
Contagion,tt1598778,2011,8,"The characters here are secondary to the movie's true vision: the fear and terror of disease."
"Die Hard",tt0095016,1988,9,"This is one of the best action-thrillers I know. The element that sets it apart from all the rest is its main character: John McClane—and everything that is completely average about him."
Traffic,tt0181865,2000,8,"This one of the most blatantly meaningful movies I've seen in a long time. It establishes that its message is something of worth through the screen play and through the artistic editing and use of sound. I highly recommend it."
"12 Years a Slave",tt2024544,2013,8,"This adds another moving film to its specific genre."
"The Evil Dead",tt0083907,1981,7,***
"Evil Dead II",tt0092991,1987,8,"While it is not as scary, this movie demonstrates more what was intended in the first—a fun action movie."
Tootsie,tt0084805,1982,8,"Tootsie made me laugh the entire time—and it managed to have something valuable to say."
"Date Night",tt1279935,2010,6,***
Shutter,tt0440803,2004,6,***
"Gangs of New York",tt0217505,2002,9,"This epic has much to say about unity and race politics, yet its greatest virtue is found in its performances and its exaggerated thrills."
Interstellar,tt0816692,2014,9,"Sitting on the edge of my seat, I could not help but wonder how Nolan had stolen all of my childhood dreams. His newest film, Interstellar, has finally brought to the big-screen everything I had hoped for and imagined about space in my younger years—it did this with added creativity and suspense. The movie is certainly one of the best movies I have seen this year, adding to Nolan's tasteful commentary on ethical systems and giving us McConaughey's best performance to date. Furthermore, I cannot help but respect the film's tributes to 2001 and how Nolan works within that legacy. With the exception of the last 3 minutes, I admit that I found most of the last third to be a bore and inconsequential to the movie's grandeur. Still, Nolan has done something fantastic here."
"The General",tt0017925,1926,9,"I'm tempted to give it a 10, given its timely handicap. I laughed out loud multiple times and was continuously impressed by the stunts and camera. In my opinion, this outshines any Chaplin film, and is one of the best film-history has to offer."
"The Hunger Games: Mockingjay - Part 1",tt1951265,2014,7,***
Serendipity,tt0240890,2001,6,"Cute and funny at times. The themes it puts forward, though, are obnoxious."
"On the Waterfront",tt0047296,1954,10,"No one is cooler or smoother than Marlon Brando's Terry Malloy, but you cannot help but weep for the poor fool. He's found his safe niche in a corrupt system, and people even toss him the occasional favor. Yet he can't get comfortable thanks to the lovely Eva Saint. We watch as Terry and the others on the waterfront march upward and onward, escaping the life of a D&D bum. Along the march, Kazan and Schulberg give us some unforgettable shots and lines, and remind us of how things still have to change."
Brave,tt1217209,2012,7,***
"Gone Girl",tt2267998,2014,9,"Gone Girl is an exceptionally dark comedy. It is also incredibly suspenseful—in fact, watching it was the most stressful activity I've been a part of in a long time.  "
"The Swimmer",tt0063663,1968,8,"It's a tragic dream about one man's delusion."
"Dirty Dancing",tt0092890,1987,7,"The romance is believable, but the themes are despicable."
Selma,tt1020072,2014,8,"The best parts of this movie are a couple slow-motion scenes which capture the cruelty of the era, LBJ who is both believable and sympathetic, and the speeches from Dr. King which capture the strongest asset of the Civil Right's leader. I appreciated the humanizing of King (and of Johnson), though I did not find it as tastefully done as in ""Lincoln."" I also did not feel that the movie fully capitalized on the timbre of MLK's voice."
"Searching for Bobby Fischer",tt0108065,1993,8,"It is one entry in a popular and predictable genre, but it is done tastefully. Its subject also seems more beautiful and regal than the others."
Boyhood,tt1065073,2014,7,"This movie reminds me of three others: the Truman Show, Before Sunrise, and Seven Up!—all of which were better than this one. Still, I enjoyed the coming-of-age story, relishing in the frequent scenes that captured mundane life in its grandeur and humor. While sometimes I thought the movie delved too far into existentialism than it could handle, the performances of Hawke and the other parents brought it due weight."
"Birdman or (The Unexpected Virtue of Ignorance)",tt2562232,2014,9,"While the casting is probably my favorite part of this movie (something I've never said before), I greatly enjoyed its artistic approach and profoundly stated message."
"The Grand Budapest Hotel",tt2278388,2014,8,"It maintains most of the vices of Anderson's previous films, but excels with more humor and potent themes than some."
"American Sniper",tt2179136,2014,7,"A. O. Scott—among others—has pointed out that Eastwood's American Sniper is a Western in War-time's clothing. I think it should be watched and respected as such. The movie is based on black-and-white convictions about violence, while still being able to acknowledge some of the heartache that comes with the territory (something Eastwood has made a career of). It never delves into politics and debate, but that was assumed. It is not his most noble work, nor his most thematic—but it is good."
"The LEGO Movie",tt1490017,2014,8,"This movie does a lot right and not much wrong. It is both funny and thoughtful.  "
"Fast & Furious",tt1013752,2009,5,***
"Midnight in Paris",tt1605783,2011,8,"Like Allen's other work, it is witty and has a little something to say."
"The Island",tt0399201,2005,6,***
"Life of Pi",tt0454876,2012,9,"At the time of writing this, I have not read the book, and I am afraid it may make me biased. That's because the *story* for this movie is incredible—moving, interesting, and profound. It is even greater than Lee's magnificent visual effects."
"Dan in Real Life",tt0480242,2007,6,"There are some sweet scenes, but also an overabundance of cliche. "
"The Amazing Spider-Man 2",tt1872181,2014,5,"The movie is entertaining, as Marc Webb and Sony assured us it would be, but it is lost. It is lost among a host of undeveloped characters, and—what is worse—it is lost in what it means to be Peter Parker and to teach Peter what it means to grow up."
Luther,tt0309820,2003,6,"I am particularly interested in the movie, but it tries to cover too much—not enough time is devoted to any character or arc."
"Thor: The Dark World",tt1981115,2013,7,"It doesn't add much to the superhero genre."
"The Agony and the Ecstasy",tt0058886,1965,8,"The movie starts out fair but steadily increases all the way up until the end. Its best scene involves Michelangelo and Pope Julius standing under the creation of man at night, discussing the true image of God."
"Avengers: Age of Ultron",tt2395427,2015,8,"The second Avengers movie marks a demarcation in the MCU between movies that are entertaining and good and movies that are excellent. Though Whedon’s directorial vision was surely compromised by the studio, his flair and care for the characters is clear. While one might point to the inconsequential villain as the movie's downfall, it’s only real vice is not living up to the hype."
